{
  "version": "1.0.0",
  "scope": "Vyper >=0.4.0",
  "last_reviewed_at": "2026-03-01",
  "stale_after_days": 30,
  "sources": [
    {
      "name": "Vyper Security Advisories",
      "url": "https://github.com/vyperlang/vyper/security/advisories"
    },
    {
      "name": "Vyper Docs Release Notes",
      "url": "https://docs.vyperlang.org/en/stable/release-notes.html"
    }
  ],
  "entries": [
    {
      "rule_id": "VYP-31",
      "advisory_id": "GHSA-vgf2-gvx8-xwc3",
      "cve": "CVE-2025-21607",
      "title": "ecrecover and identity precompiles success values are not checked",
      "affected_versions": "==0.4.0",
      "fixed_versions": ">=0.4.1",
      "status": "fixed",
      "url": "https://github.com/vyperlang/vyper/security/advisories/GHSA-vgf2-gvx8-xwc3"
    },
    {
      "rule_id": "VYP-32",
      "advisory_id": "GHSA-4w26-8p97-f4jp",
      "cve": "CVE-2025-27105",
      "title": "AugAssign targets for nested DynArrays can access out of bounds data",
      "affected_versions": "==0.4.0",
      "fixed_versions": ">=0.4.1",
      "status": "fixed",
      "url": "https://github.com/vyperlang/vyper/security/advisories/GHSA-4w26-8p97-f4jp"
    },
    {
      "rule_id": "VYP-33",
      "advisory_id": "GHSA-2p94-8669-xg86",
      "cve": "CVE-2025-26622",
      "title": "Incorrect result values from builtin sqrt implementation",
      "affected_versions": "==0.4.0",
      "fixed_versions": ">=0.4.1",
      "status": "fixed",
      "url": "https://github.com/vyperlang/vyper/security/advisories/GHSA-2p94-8669-xg86"
    },
    {
      "rule_id": "VYP-34",
      "advisory_id": "GHSA-h33q-mhmp-8p67",
      "cve": "CVE-2025-27104",
      "title": "for-loop over conditional expression causes iterator re-evaluation",
      "affected_versions": "==0.4.0",
      "fixed_versions": ">=0.4.1",
      "status": "fixed",
      "url": "https://github.com/vyperlang/vyper/security/advisories/GHSA-h33q-mhmp-8p67"
    },
    {
      "rule_id": "VYP-35",
      "advisory_id": "GHSA-3vcg-j39x-cwfm",
      "cve": "CVE-2025-47774",
      "title": "slice skips side effects when length is zero",
      "affected_versions": "==0.4.0 || ==0.4.1",
      "fixed_versions": ">=0.4.2",
      "status": "fixed",
      "url": "https://github.com/vyperlang/vyper/security/advisories/GHSA-3vcg-j39x-cwfm"
    },
    {
      "rule_id": "VYP-36",
      "advisory_id": "GHSA-qhr6-mgqr-mchm",
      "cve": "CVE-2025-47285",
      "title": "concat skips side effects for zero-length arguments",
      "affected_versions": "==0.4.0 || ==0.4.1",
      "fixed_versions": ">=0.4.2",
      "status": "fixed",
      "url": "https://github.com/vyperlang/vyper/security/advisories/GHSA-qhr6-mgqr-mchm"
    },
    {
      "rule_id": "VYP-37",
      "advisory_id": "GHSA-g2xh-c426-v8mf",
      "cve": "CVE-2023-40015",
      "title": "Evaluation order mismatch between Python and generated bytecode",
      "affected_versions": "==0.4.0 || ==0.4.1 || ==0.4.2",
      "fixed_versions": "unfixed",
      "status": "unfixed",
      "url": "https://github.com/vyperlang/vyper/security/advisories/GHSA-g2xh-c426-v8mf",
      "notes": "Treat as potentially affected for any 0.4.x contract until upstream fix lands."
    }
  ]
}
